{
  "$schema": "https://json-schema.org/draft/2020-12/schema",
  "$id": "https://aadp.dev/schemas/modules/evidence/v1.0/claim.schema.json",
  "title": "AADP Evidence Module v1.0 — Claim",
  "description": "Top-level module document kind `claim`: the value of an AADP v1.0 entity's `x_evidence` field, on an entity with `type: \"claim\"` (specification.md §4). Nested inside an already-versioned entity, so it self-describes `module`/`version`/`kind` but not `aadp_version`. Like Answer `1.0`, the Evidence wrapper has NO `x_*` extension point (specification.md §5) — the Relations extension point on `evidence_refs[].target` is unaffected. Code-point bounds after trimming, the duplicate-target rule and `content_checksum` are pure semantic rules, not expressible here.",
  "type": "object",
  "required": ["module", "version", "kind", "statement", "locale", "evidence_refs", "content_checksum"],
  "properties": {
    "module": { "const": "aadp:evidence" },
    "version": { "const": "1.0" },
    "kind": { "const": "claim" },
    "statement": { "type": "string", "minLength": 1 },
    "locale": {
      "type": "string",
      "maxLength": 63,
      "pattern": "^[a-z]{2,3}(-[A-Z][a-z]{3})?(-(?:[A-Z]{2}|[0-9]{3}))?(-(?:[a-z0-9]{5,8}|[0-9][a-z0-9]{3}))*$"
    },
    "evidence_refs": {
      "type": "array",
      "minItems": 1,
      "maxItems": 50,
      "items": { "$ref": "evidence-reference.schema.json" }
    },
    "content_checksum": { "type": "string", "pattern": "^sha256:[a-f0-9]{64}$" },
    "notes": { "type": "string", "minLength": 1 }
  },
  "additionalProperties": false
}
